{
  "kind": "agent-procedure",
  "spec_version": "0.1.0",
  "procedure_id": "minimal-procedure",
  "revision": "1",
  "title": "Minimal Procedure",
  "summary": "Smallest valid APD graph.",
  "entry_conditions": [
    "A minimal test run is requested."
  ],
  "inputs_schema": {
    "type": "object",
    "properties": {},
    "additionalProperties": false
  },
  "outputs_schema": {
    "type": "object",
    "properties": {},
    "additionalProperties": false
  },
  "entities": [],
  "procedure": {
    "start_node": "done",
    "nodes": [
      {
        "id": "done",
        "type": "terminal",
        "name": "Finished",
        "outcome": "success",
        "observed_vs_inferred": "authored",
        "extensions": {}
      }
    ],
    "transitions": []
  },
  "provenance": {
    "producer": "fixture-generator",
    "source_type": "authored",
    "created_at": "2026-04-12T12:30:00Z",
    "confidence": {
      "overall": 1,
      "per_node": []
    },
    "observed_vs_inferred_summary": "Minimal hand-authored fixture."
  },
  "extensions": {}
}
