{
  "kind": "agent-procedure",
  "spec_version": "0.1.0",
  "procedure_id": "observed-missing-capture-scope",
  "revision": "1",
  "title": "Observed Without Capture Scope",
  "summary": "Observed fixture that intentionally omits capture metadata to verify warning behavior.",
  "entry_conditions": [],
  "inputs_schema": {
    "type": "object",
    "properties": {}
  },
  "outputs_schema": {
    "type": "object",
    "properties": {}
  },
  "entities": [],
  "procedure": {
    "start_node": "step_1",
    "nodes": [
      {
        "id": "step_1",
        "type": "action",
        "name": "Review observed material",
        "instruction": "Review the observed workflow notes.",
        "observed_vs_inferred": "observed",
        "extensions": {}
      },
      {
        "id": "done",
        "type": "terminal",
        "name": "Done",
        "outcome": "success",
        "observed_vs_inferred": "observed",
        "extensions": {}
      }
    ],
    "transitions": [
      {
        "from": "step_1",
        "to": "done",
        "default": true,
        "observed_vs_inferred": "observed"
      }
    ]
  },
  "provenance": {
    "producer": "fixture-generator",
    "source_type": "observed",
    "created_at": "2026-04-13T10:00:00Z",
    "confidence": {
      "overall": 0.76,
      "per_node": [
        {
          "node_id": "step_1",
          "confidence": 0.76
        }
      ]
    },
    "observed_vs_inferred_summary": "Observed fixture intentionally missing capture metadata so validators can warn."
  },
  "extensions": {}
}
