{
  "kind": "agent-procedure",
  "spec_version": "0.1.0",
  "procedure_id": "orphan-node",
  "revision": "1",
  "title": "Orphan Node",
  "summary": "Valid schema fixture with an unreachable node.",
  "entry_conditions": [],
  "inputs_schema": {
    "type": "object",
    "properties": {}
  },
  "outputs_schema": {
    "type": "object",
    "properties": {}
  },
  "entities": [],
  "procedure": {
    "start_node": "step_1",
    "nodes": [
      {
        "id": "step_1",
        "type": "action",
        "name": "Reachable step",
        "instruction": "Perform the reachable step.",
        "observed_vs_inferred": "authored",
        "extensions": {}
      },
      {
        "id": "orphan",
        "type": "action",
        "name": "Unreachable step",
        "instruction": "This node is never reached.",
        "observed_vs_inferred": "authored",
        "extensions": {}
      },
      {
        "id": "done",
        "type": "terminal",
        "name": "Done",
        "outcome": "success",
        "observed_vs_inferred": "authored",
        "extensions": {}
      }
    ],
    "transitions": [
      {
        "from": "step_1",
        "to": "done",
        "default": true,
        "observed_vs_inferred": "authored"
      }
    ]
  },
  "provenance": {
    "producer": "fixture-generator",
    "source_type": "authored",
    "created_at": "2026-04-12T13:03:00Z",
    "confidence": {
      "overall": 1,
      "per_node": []
    },
    "observed_vs_inferred_summary": "Valid fixture with a graph warning."
  },
  "extensions": {}
}
